{
  "data": {
    "end_user_tariff": {
      "country_code": "FR",
      "party_id": "CMP",
      "id": "cmp-elc-dc-2026-09-peak",
      "currency": "EUR",
      "type": "REGULAR",
      "elements": [
        {
          "price_components": [
            { "type": "ENERGY", "price": 0.59, "vat": 20.0, "step_size": 1 }
          ]
        }
      ],
      "last_updated": "2026-09-17T10:00:00Z"
    },
    "end_user_total_cost": { "excl_vat": 12.40, "incl_vat": 14.88 },
    "currency": "EUR"
  },
  "status_code": 1000,
  "status_message": "Success",
  "timestamp": "2026-09-17T10:00:02Z"
}
