{
  "data": {
    "pricing_status": "AVAILABLE",
    "end_user_total_cost": {
      "before_taxes": 2.05,
      "taxes": [ { "name": "VAT", "percentage": 20.0, "amount": 0.41 } ]
    },
    "currency": "EUR",
    "last_updated": "2026-09-17T09:12:00Z",
    "tariff": {
      "country_code": "FR",
      "party_id": "XYZ",
      "id": "xyz-dc-2026-09-promo50",
      "currency": "EUR",
      "type": "REGULAR",
      "tax_included": "YES",
      "elements": [
        {
          "price_components": [
            { "type": "ENERGY", "price": 0.294, "vat": 20.0, "step_size": 1 }
          ]
        },
        {
          "price_components": [
            { "type": "PARKING_TIME", "price": 7.2, "vat": 20.0, "step_size": 1 }
          ],
          "restrictions": { "min_duration": 1800 }
        }
      ],
      "last_updated": "2026-09-17T09:05:00Z"
    }
  },
  "status_code": 1000,
  "status_message": "Success",
  "timestamp": "2026-09-17T09:12:03Z"
}
